"cleaned_comment","likes_count"
"tuhan sudah menumbuhkan tembakau untuk sebuah manfaat...ada petani..ada pabrik..ada pekerja..ada distribusi..ada pedagang dll yang hidup dari rokok...kalo bisa juga cari manfaat lain selain buat rokok dan mampu menyerap tenaga kerja yang bisa ikut menikmati hidup dinegeri yang saat ini benar benar susah cari kerja.","0"
"semoga cukai rokok bisa diturunkan agar tenaga kerja yang kena phk bisa bekerja kembali .. kasihan para pekerja yang kena phk mereka juga butuh income untuk biaya hidup !! semoga menkeu lebih bijak dalam menerapkan kebijakan !! kemanusiaan lebih utama daripada kebijakan yang tidak bertanggungjawab !!","0"
"sehat selalu pak mentri purbaya. gbu","0"
"mudah2n ada perubahan yg lebih baik..sungguh makin sulit untuk petani skrg termasuk tembakkau tahun ini penjualan dipetani macet n murah pas biaya makin gede pupuk sulit","0"
"saya merokok sejak harga sebungkus rokok sebungkus sekitar 250 rupiah, sekarang kelas yang sama kisaran 25.000 30.000","0"
"tetap berjuang untuk rakyat pakk!!","0"
"pak purbaya menjelaskan dengan bahasa rakyat....","0"
"sy suka mentri ini, analisanya tajam dan cepat.jangan nambah hutang ya pak.","0"
"yang terpenting jangan biarkan rokok ilegal bebas dijual di online pak menteri..","0"
"ini baru menteri","0"
"masalahnya rokok itu di tutup, rokok ilegal malah beredar semakin liar dan luar biasa.itu harus di perbaiki pak, karena berpengaruh ke petani tembakau juga, banyak hal yg di buat kebijakan yg bodoh 1x sebelumnya.termasuk pembatasan plastik, malah kita harus bayar dan beli tas lagi padahal dulu gratis.mantap untuk menkeu yang baru ini, dia bisa melihat masalah2 di lapangan","0"
"terbaik...","0"
"bismillahirrahmanirrahim lancar . ini baru mentri keuangan","0"
"luarbiasa analisis nya pak","0"
"aku suka gaya bapak satu ini, keren lah...","0"
"mantab ini pa mentri, semoga ada perubahan yg signifikan","0"
"satu biji rokok surya cukainya 1.200 dan harga rokok cuman 26.000 intinya 14.000 per satu bungkus untuk cukainya bayangkan berapa besar masyarakat pecinta rokok surya membayar pajak selama setahun merokok, berapa besar stiap tahunya gudang garam membayar cukai tsb, mahal bgt buat apa uangnya makanya turunkan cukai agar tidak banyak rokok ilegal","0"
"nah gitu dong... mantap pak.. jangan sikit2 hutang,, sikit2 naikin pajak... kalau di dealer mobil, kalau ada nasabah beli mobil kredit, maka salesmen dan atasan dapat uang fee refund dari lembaga pemberi kredit, lumayan besar lho. kalau bank dunia mengucurkan dana ke indonesia, kira2 dapat berapa ya refund nya?? hanya pemikiran saya.","0"
"pak pur","0"
"dari gestur dan tutur kata memang beliao seperti nya orang yang kompeten","0"
"terus bekerja saja ..dan lakukan itu dengan secermat mungkin biar semua terungkap apa yg menyebabkan kegagalan jangan sampai rakyat mencium ketidak beresan..perhatikan semua pergerakan keuangan negara dari semua bidang ...biar ekonomi stabil..","0"
"pak kalo bisa mbg d ganti buat sekolah2 pelosok aja saya rasa anak2 butuh pendidikan yg lebih layak juga, dan untuk industrialisasi saya setuju dengan bapak perbanyak lapangan kerja dan industri di seluruh indonesia kami butuh pancing bukan cuma di kasih ikannya saja, mudahan indonesia bisa lebih baik dengan mentrinya yg baru","0"
"menteri keuangan bpk purbaya, beda 360 derajat dengan mantan menkeu sri mulyani, pak purbaya lebih sangat terbuka , lebih peduli terhadap kejadian yang sedang berjalan..contoh mengenai keadaan cukai rokok yang tidak adil buat perusahaan legal dan akan memproses rokok ilegal","0"
"ini baru kerja","0"
"luar biasa bapak ini, salut !","0"
"mudah mudahan menkeu yg baru lbh baik","0"
"intinya cukai rokok itu memperkaya pejabat, tidak ngotak tarifnya","0"
"lanjutkan pak menku kami sangat setuju","0"
"lanjut pak ..","0"
"mudah2an tegas seluruhnya pak purbaya","0"
"sebenarnya tidak masalah punya pajak rokok tinggi. tetapi jangan salahkan konsumen menurun karena pendapatan yang kurang. asal negri ini adil pendapatan sesuai dengan ekonomi semua juga bisa dibeli rakyat","0"
"pak prabowo ngga salah pilih menteri... mantap","0"
"cocok jd wapres 2029 dampingi pak prabowo","1"
"mantap pak, cari pendapatan negara dari barang masuk atau barang import yang bisa di sediakan dalam negeri, bebaskan pajak sampai nol , untuk bahan baku yg dibutuhkan industri dalam negeri, dengan kreteria standart mutu tinggi","0"
"org yg mengerti tata dan langkah kerja dibidang tugasnya ya seperti ini.","0"
"sehat slalu bwt bpk mentri","0"
"dengan harga yang tinggi bagi rokok terkenal selama ini gak terjangkau akhirnya perokok milih rokok yang harga terjangkau","0"
"bapak sy pantau trs ni,,, smga amanah trs sswai dgn omongannya ya pak,, msh berharap kmu d bantu allah bs mmperbaiki perekonomian rakyat indonesia,,, rokok ilegal pak trll bnyk smp masuk kota dn plosok2,, jdi biasa qt dpt hrga rokok 27 up lah ad rokok ilegal hrga 10 15 dh isi 16 tolong,,, jdi tdk mngurangi konsumen rokok ,,,","0"
"orang teknik kalo merencanakan pemecahan permasalahan pasti melihat dampak jangka panjangnya, itu yang bener. ini orang teknik pinter ekonomi juga. lah paket lengkap sudah.","0"
"saya seorang pedagang pak.. dan kenapa banyak orang yang membeli roko elegal palsu atau murahan lah karna rokok resmi harganya melonjak bukan main pak... bukan saya ingin jual rokok gak resmi palsu akan tetapi rokok resmi jauh dari kemampuan mereka pembeli rokok resmi...","1"
"mbg kasih duitx saja pak, kasih mentahx saja.","1"
"mbg di satu sisi baik, tp juga merugikan banyak pedagang kecil keliling, kantin dll","0"
"baiknya segera kan dicari mitigasi nya, agar semua bisa tetap kerja, tp rakyat nya ttp sehat..","0"
"setuju pak menkeu purbaya, buang laporan data yang abs asal bapak senang, hanya akan menyesatkan,dan jauh dr perbaikan kondisi perekonomian di negri ini","0"
"yang begini , mentri yg harus nya ad harus nya dr dulu , tau mensejahterah kan lapangan kerja ..","0"
"mantap pak mentri","0"
"luar biasa the best purbaya","0"
"ini namanya ekonom hebat","0"
"inilah sosok yang di butuhkan indonesia , saya harap pak anies dan pak mahfud masuk dalam tim pak prabowo .","0"
"setidaknya dia punya logika yang fair.","0"
"sri sri kamu membuat orang jadi lebih sulit tanpa memahami bahwa rokok tanpa cukai sudah beresar buanyak. cek statistiknya dong","0"
"menteri keuangan terbaru tercinta","0"
"pantes rokok mahal tapi petani tembako gak sejahtera.","0"
"pak mentri ini kelihatan cerdasnya dalam analisa","0"
"efek tinggi nya cukai rokok, para perokok beralih ke rokok ilegal atw non cukai. efek nya rokok yg legal cukai nya, jadi menurun penjualannya. dan dampak paling akhir, perusahaan rokok akan mengurangi para pekerja. hitung habis habisan pak, termasuk devisa dari kementerian lainnya, seperti menteri perdagangan, menteri bumn, menteri tenaga kerja, imigrasi, hgu, lahan berikat dan lainnya yg menjadi devisa negara. mainkan hitungan resistor dan kapasitor sehingga jadi hemat dalam pemakaian listrik. semangat pak.","1"
"mantaaap pak mentri, turunkan juga pajak pajak yang lain, terutama yang menindas masyarakat miskin.","0"
"mantap semua lini di cambangi, teruskan pak","0"
"moga aja pa mentri bisa bekerja dgn baik..","0"
"menurut saya mengurangi jumlah perokok dg cara menaikan cukai dan harga rokok, tidak akan berefek apapun. kami hanya akan mengganti merk lain yg lebih terjangkau","0"
"semoga bapak sukses mengatasi ekonomi skarang ini pak","0"
"tiga org aja kayak bapak ini, satu di ekonomi, satu di hukum, satu lagi di birokrasi, mungkin sudah hemat brp uang. karena gak perlu lagi banyak banyak menteri.","0"
"yang betul bukan rokok palsu tapi tanpa cukai. kalau punya cukai maka ga akan di kejar. jadi masalahnya cukai tak dibayar.","0"
"alhamdulillah","0"
"ini baru menteri keuangan......","0"
"wah hebat pak menkeu...saya salut dg cara pikir bapak","0"
"good mr realistis, tq.","0"
"hebat men keu pk purbaya","0"
"kerens sih pemikiran bapaknya. tdak boleh menerbitkan kebijakan yg mlah 'membunuh' tenaga kerja itu. harus disiapkan wadah untuk yg di phk itu. good job idea","0"
"keren pak prabowo, mndpat mntri sekelas ini","0"
"buka lapangan kerja di setiap kecamatan bpk mentri yg menyerap ribuan, biar tiap kecamatan ekonomi makmur","0"
"ayo pak banggakan suku sunda","0"
"semestinya, sudah lunas utang negara ini dilihat dari uang cukai rokok selama ini dong!!!!! gak jelas bagian keuangan kita......","0"
"semoga pak purbaya jujur dan amanah dalam mengambil kebijakan menuju indonesia maju","0"
"masalah rokok karena indonesia ditekan who salah satunya, makanya cukai tinggi, maka rakyat yg merokok beralih ke yg murah","0"
"sederhana penjabarannya....pelajari proses menentukan yg benar secara hukum dan kemanusian","0"
"mudah2an ada titik terang buat industri lokal","0"
"pak purbaya setuju","0"
"gambaran contoh kasar... harga btg rp.2300 cukai rp.1200x16btg hari. jml perokok aktif indonesia usia produktif 30 x280jt jiwa. perhari masukan dr cukai rokok kurleb... 1500 m .","0"
"pemikiran pk menkeu bener2 representasi harapan rakyat. layak maju capres.... pdip ambil kandidat ini.... josss...","1"
"gw sih jujur penasaran banget kalo bliau ngobrol bareng kdm kayaknya bakal seru dan sepemahaman.","0"
"setuju bagus lanjutkan","0"
"ayo pak . turunkan harga cukai. biar rokok gak mahal2.","0"
"sederhana jelas padat","0"
"selamatkan negeri ini dari pajak yg tinggi,agar ekonomi indonesia jalan,perputaran uang jalan,rakyat semakin produktif","0"
"akhirnya dapat menteri yang bukan srimulat","1"
"menaikan cukai rokok tdk akan menekan konsumsi rokok, karena akan muncul industri ilegal , karena bahan bakunya bisa di tanam oleh petani...","0"
"terima kasih pak menkeu. semoga kau di beri olloh hu taala umur panjang. ami","0"
"logis dan mudah dicerna. masuk akal pak","0"
"contoh orang cerdas solusi dulu baru bertindak","0"
"seneng gue sma pak menteri","0"
"pajak roko emang mahal, masarakat hanya terpaksa membelinya , karna tidak merokok tau sendirilah hanya orng yg paham merokok","0"
"banyak sekali dampaknya cukai rokok mahal, sekarang tembakau lapangan di daerah murah, terjadi lapangan kerja menurun, dan para pedagang pakaian makanan jadi kurang laku, di karena kan tanam tembakau, jika tidak untung sedikit paling rugi besar dan ikat kepala mau pecah, lihat cuaca hujan besar..","0"
"makin kesini makin like sm pak p... gass poll pak... good job","0"
"keren mengayomi,, bijaksana","0"
"orang sunda. pemimpin nya baik2 ya","0"
"alhamdulillah, mantab pak","0"
"pegawainya juga di periksa pak dari yg jabatan rendah sampai yg tinggi .","0"
"pak purbaya pendekar sejati .","0"
"mantab pak purbaya lugas gamblang. kecilkan pajak menyerap tenaga kerja pabrik rokoknya.","0"
"semangat pak","0"
"turunin cukai rokok pak...ada berapa juta perokok di indonesia akan mendukung anda","0"
"57 dari harga itu di setor ke negara, tapi negara tidak mampu memjamin industri ini dari rokok ilegal, uangnya aja yang mau, tapi kerja dan tanggung jawabnya kagak","0"
"semoga bpk mjd pahlawan rakyat... rakyat bkn pemalas rakyat sudah bekerja keras hanya saja bahan kebutuhan pokok mahal n tdk sesuai dgn gaji yg di terima","0"
"cukai rokok 57 ,lalu uang pajak cukai dikorupsi sama para fir'aun.. mending beli rokok yang noncukai,itung itung kita bantu usaha kecil menengah","0"
"mantap pak pur terus bekerja","0"
"aq suka cara ngomongnya.. kita jdi lebih tahu","0"
"semogah pak mentrinya sehat selalu,bukan hanya pencitraan","0"
"bagus banget pemikirannya","0"
"mantap pak utek nya.....terus maju","0"
"sambil merem nyimaknya jadi keinget sama alm rizal ramli.","0"
"kalau bisa mbg di bagi pak porsinya biar semakin banyak kegiatan,mungkin maksimal 500 porsi,biar dak terlalu over 1orang bisa ribuan porsi, akibatnya mbg makanan jadi kurang segar soalnya masaknya malam di kerja porsi yg terlalu banyak,mungkin 1 umkm maksimal 500 itu saran saya,atau di setiap sekolah orang kampung itu sendiri yg ngelolan mbg nya","0"
"baru menjabat sdh jatuh hati ay","0"
"keren pak, keren, smoga smakin kesini, smoga makin makin, minimal smakin lumayan, mengherakkan sektor industri pnyerap tnaga krja","0"
"pak menkeu juga mesti mikirin pembayar2 pajak kelas menengah dg pph 15 25 sudah megap2 rawan tertarik kekelas bawah bahkan miskin. perbaiki lg layer pajak, naikan kontribusi tka untuk negara dg langsung memberi pajak tertinggi supaya sdm yg masuk benar2 tenaga ahli","0"
"lanjutkan pak mentri","0"
"logika bapak sangat masuk akal,","0"
"pekerjaan yg paling mudah dan menyenangkan adalah... menghabiskan uang.... jadi pak mentri, harus lebih waspada dan berhati hati soal kucuran uang 200 triliun itu...","0"
"mantap pak mentri.","0"
"dulu mana pernah ada audiensi begini ya dengan kementrian, kita cuma disuruh nelen aja kebijakan mereka. bravo pak memkeu purbaya","0"
"pak menkeu mau datang ke jawa timur kediri ke pabrik gudang garam.. ayo pak turun lapangan biar cukai turun","0"
"gokil nih mentrii omongan nya simpel tapi strategis","0"
"menurut saya naik harga rokok tidak berpengaruh signifikan terhadap pengguna rokok. harga rokok mahal membuahkan solusi munculah rokok tanpa cukai harga murah, mereka terap aja merokok tapi dengan beralih rokok murah, malah akibatnya menurunkan produksi pendapatan rokok dalam negeri. keuangan kita bocorrrrr . akibatnya ya itu karyawan pada dipecat jadi pengangguran karena efesiensi pabrik rokok,","1"
"kwsimpulan yg tepat pak , mantapp","0"
"mantap pak mentri","0"
"omongannya masuk akal dan fair, mantap","0"
"ganteng nih orang solusinya ga kebijakan sepihak, tapi kebijakan yang juga mengayomi lanjutkan pak mentri","0"
"menkeu kereen","0"
"bagus lanjuttt","0"
"pak, rokok cukainya tinggi gpp walaupun mempengaruhi lapangan kerja, tp udah pasti nanti bocah2pun pada bisa beli rokok. rokok cukainya mahal aja mereka bisa beli. dikasih uang jajan sekolah malah buat beli rokok, nongkrong, ga jadi sekolah. masih banyak ladang di indonesia, terutama tambang. terakhir saya ke makasar nikel di pegang sama cina kata temen saya. pantes satu pesawat batik waktu saya ke makasar banyak orang cina. terus temennya temen saya di makasar info juga, malah udah sampe neira katanya. ini baru bahas soal nikel. masih banyak tambang dan sda lain di indonesia. regulasi expat bekerja di indonesia juga harus di rubah. bukan selalu expat yang ada di level atas sedangkan lokal di bawah. saya paham mungkin mereka punya nilai investasi tinggi di negara kita untuk membangun sebuah perusahaan. tp kan bukan berarti semuanya di keruk sampai ke sdm kita. disitulah keunggulannya para pejabat2 ini membentuk sebuah sistem yang sistematis, produktif dan efisien ke semua level. kalo semuanya minus untuk indonesia dan rakyat, sama dengan kita masih di jajah dong. sejauh ini saya kerja ke negara uae. semua sistem berbasis legal sebagai non lokal tidak ada hal kepemilikan. dan lokal disini gajinya lebih tinggi daripada expat. bahkan sampai jam kerja mereka suka2 dia aja walaupun ada jam kerjanya juga teruntuk orang2 mereka. kalo udah punya sistem kayak begini negara mana dan bangsa mana yang berani?? ya saya juga paham mungkin butuh proses untuk perbaikannya. tapi kita bisa liat dari sisi negara sebrang ini, sistem yang mereka bentuk itu kuat. sehingga ga ada pihak manapun yang di rugikan. just saran.","0"
"keren pak. ekonomi menengah kebawah yg menjerit terasa daya beli dll menurun..","0"
"semogah pak purbaya dsn kdm r1 dan ri2 amin","0"
"bagus pak sampai dampak kebijakan juga harus dicarikan solusinya, keren smg amanah untuk rakyat menegah bawah pak menkeu baru","0"
"pro rakyat, keren mentriku","0"
"tepuk tangan","0"
"mana spt ni bu sri?....kereeen pa","0"
"pak saya petani tembakau tolong cukae rokok di turunin, kalao gak turun dampaknya petani tembakau rugi terus","0"
"jadi bukan karena banjir rokok ilegal. tapi masyarakat sdh balik ke tradisional. gak pada beli rokok pabrikan. sudah balik ke rokok linting dewe jadi pada beli tembakau langsung dari petani.","1"
"hebat mentri ini,","0"
"mantaaaap.....gassss poool pak ....","0"
"siap siap aja kita sebagai masyarakat harus tangkis serangan opini dan berita hoaks negatif yang nanti nya akan datang, karna orang orang yang seperti ini pa prabowo, kdm dan pa purbaya ga akan membuat nyaman bagi oknum koruptuor seperti yang sudah ter struktur dan terorganisir di negara ini.","0"
"the best pak menkeu hiji oge maung","0"
"mentri yg cerdas bngt","0"
"hebat","0"
"ini kalau di sandingin sama wapres jauh amat.. ibarat real estate vs rumah reot.. pemikirannya luas, ga cuman janji 19 juta lapangan kerja..","0"
"57 saya sangat setuju sekali, apa salahnya 57 ? kl perlu ditambah lg. pengangguran ya ada industri lain selain rokok, itu kementrian perindustrian, kementrian sdm gmn? itu bukan tugas kementrian keuangan menurut saya. menurut saya cukai rokok tinggi, bisa untuk mengurangi beban pajak kebutuhan pokok.","0"
"bpk menkeu ini santai bgt dan sering bgt melayani press,... klo yg sebelum nya seperti terbatas dan takut sama press","0"
"turunkan pajak ppn pak, dan penghasilan juga turunin untuk masyarakat klas bawah. dn perketat pajak barang mewah dan pajak penjabat dan orang orang kaya.","0"
"pak. hilangkan bunga untuk kredit bank keperluan umkm dong pak. biar ekonominya muter dulu baru ketika kredit ke 2 ada bunganya disaat usaha udah pasti naik butuh modal kelanjutan. atau dikasih persyaratan keringanan ketika kreditur melampirkan invoice pembelanjaan untuk usaha ke bank.","0"
"mantap purbaya.tindakan yg tepat.","0"
"mantap","0"
"mantap pak","0"
"mudahan amanah pak, aamiin","0"
"semoga benar2 mengabdi utk negara...","0"
"boleh juga pak idenya....masuk akal..semoga bisa segera diterapkan","0"
"enak jawab nya ""sy pelajari dlu ya"", paling ga dia jujur dan ga asal jawab klo blm memahami. walaupun di pelajari atau ga nanti nya. drpd di jawab ""lah kok tny sayaaaaaaa","0"
"mntap pakk semoga selalu d jlan yg benar tdak tergoda uang","0"
"alhamdulillah...semoga menjadi landasan positif bagi para pengambil kebijakan..istiqomah selalu pro aktiv syafaqillah menkeu sekarang menuju kebaikan.","0"
"pajak cpo kelapa sawit jga perlu d refisi ulang pak, terlalu tinggi sehingga sangat memberat kan petani kelapa sawit.","0"
"yg mau dikurangi itu bkn jumlah perokok dgn mencekik pajak tp jumlah biaya yg harus ditanggung rakyat lewat pajak untuk menghidupi gaji dan tunjangan2 pejabat yg diluar nalar","0"
"mantab dan sangat logic akal sehat","0"
"kasih jalan untuk pengusaha pengusaha baru jangan persulit perijinan jangan dimonopoli brand brand besar saja,cukai turun brand brand besar sumringah bisa tindas lagi pengusaha pengusaha kecil yang juga pengen sukses.","0"
"sebenarnya ada bagusnya cukai tinggi, supaya orang tidak merokok.","0"
"biarlah perekonomian berputar di masyarakat pak...cukai,pajak turunkan sedasar dasar nya","0"
"jgn di turunkan, biar tambah cukainya pak, biar pemasukan byk, uang di korupsi trus dan lancar","0"
"pak koboy ini kayaknya pinter kalo denger pembicaraannya. hanya saja kita tunggu pelaksanaanya gimana.","0"
"keren pak mentri","0"
"mantap jga menteri nya yg satu ini","0"
"pasti kerja ny insyaallah bagus,ini adalah contoh menteri yg tdk terikat dgn partai","0"
"betul pk......industri kalau gk jalan berdampak bagi banyak penganguran.","0"
"kebijakan menteri sebelumnya ttg rokok mmg kurang tepat akibat diagnosis yg keliru akibatnya obat yg diberikan jg keliru. tentu masih ingat ttg statemen pejabat yg mengatakan rakyat miskin karena beli rokok, padahal klo pejabatnya cermat gk gtu jg. klo merokok mengganggu kesehatan ya bisa diterima, tetapi bukankah makanan yg dikonsumsi saat ini umumnya mengandung bahan pengawet yg memiliki resiko kesehatan cukup tinggi??? spti penjelasan bpk menteri ternyata pendapatan negara malah menurun dgn kenaikan cukai rokok, gk heran dicarikan pengganti dgn eksploitasi tambang besar""an yg ternyata dikorup jg. untk produk"" online yg kw alias palsu mmg sebaiknya dicegah bukan malah dipajakin. yg asli import bolehlah dipajakin tinggi.","0"
"klu diuji, pajak rokok yg paling terbesar, pk mentri, dg kebijakan utk mengevaluasi pajak rokok, cocok sekali,. jangan sampai ada pengurangan tenaga kerja. tksih","0"
"andaikan cukai rokok pabrikan murah seperti marlboro yg sekarng 52 rbu bks menjadi 30rb bks,kami sebagai perokok akan kembali kesetelan awal beli rokok pabrikan.","0"
"mantap pak","0"
"terus bekerja seperti ini pak.. jangan sampai kebijakan anda menyusahkan rakyat jangan mau disuap, ini pesan untuk anda kedepannya..","0"
"benar benar menarik trmuannya, ada who di belakang kebijakan yg dibterapkan.","0"
"bapak ini menteri keuangan tapi dia juga menguasai bidang ekonomi karena uang di kaitkan dengan ekonomi beda dengan srimulyani yang taunya cuma uang doang","0"
"kalo bisa prodak rokok ilegal bs dikasih izin biar tambh menyerap tenaga kerja jgn di larang biar industri makin banyak dampaknya ke rakyat makin sejah tera","1"
"sebenernya bukan ga dikasih ijin sih mas, cuma pengusahan rokok ilegal ogah minta ijin, soalnya kalau rokoknya sudah berijin pasti ada pajaknya. dan itu bikin rokoknya tambah mahal. maka nya mereka curang, ga mau dipajak","0"
"keren pak. mohon dilihat juga program dan kebijakan untuk kami di maluku.","0"
"makannya jarum hari ini di nyatakan sudah bangkrut. akibat cukai. kami para pembeli surya keberatan dan sudah biasa beralih ke roko tanpa cukai. makannya dampaknya adalah pembeli roko yg ada cukainya menurun. orang bukan berhenti meroko, karena beralih ke roko yg ekonomis tanpa pajak. apa apa di pajakin, kami sudah muak dengan negara ini. apapun di pajakin dan pajaknya sangat tinggi. bayangin negara hidup 82.4 dari pajak. kemana aja sda, bumn, dan uang dari hutang dan pajak selama ini. apakah cuma habis di korupsi. masa negara ngelola saja gak becus, apalagi kalau membuat.","0"
"semangat pak. hati yg bersih akan menuntun kita pada kebijakan yg adil dan beradab","0"
"tooppp pak ..","0"
"setuju pak menteri toooop.","0"
"aku optimis pada menteri keuangan dan menteri pertanian. okok tanpa cukai ada di beberapa minimarket dg harga 10rban. siapa yg produksi atau bekingnya ???","0"
"untuk rokok saya setuju 57 . ...","0"
"sistem ecom dibenahi pak, mereka lbh mematikan umkm daerah krna hrga yg tdk berimbang. gimana ekonomi daerah maju, org pd pny duit tp di anterin ke tmpt lain.","0"
"bijaksana.","0"
"setuju banget","0"
"bea cukai ini tdk memikirkan karyawan klau pajak rokok naik trus pasti ada phk dan banyak kena imbasnya petani tabaku dan karyawan pabrik rokok,kasiang rakyat mudah2 mentri ini boleh menurutkan pajak rokok biar karyawan tdk di phk banyak","0"
"pajak rokok tinggi menimbulkan masalah bagi perusahaan rokok resmi,yg membuat dilema karena untuk mengurangi beban produksi mau tidak mau harus mengurangi karyawan yg tentu berdampak pada bertambahnya pengangguran... untuk program mbg justru bagus karena berefek domino dalam membangun ekonomi masyarakat karena terbangun simbiosis mutialistis antara petani sebagai sumber pangan dan para pekerja di dunia kuliner, tapi ingat pengawasan yg ketat tetap di perlukan untuk mengantisipasi penyalahgunaan anggaran.","0"
"kalau saya melihat laporan gg kasihan perusahaan rokok ! ya tak manusiawi tak adil !!! ya kalau kesehatan alasan nya kasih filter dll tapi ya pajak kok gede banget !!!!","0"
"mantaaaap.... semoga harga rokok segera turun pak purbaya ocee","0"
"mentri paling loyal sama pertanyaan.","0"
"mantap pak purbaya...","0"
"ak mulai suka sama beliau inu","0"
"sehat selalu pak menteri,suka humor juga dan gaya koboynya","0"
"sementara ini stetmen pak dewa semoga terealisasi dan konsisten","0"
"selalu jaga amanah ya pak","0"
"mantap pak","0"
"mulai suka dengan menteri ini sihh...","0"
"anak anak dikalimantan barat 3 6 bulan yg bekerja survey dan pengawasi dapur mbg belum satu orangpun yg menerima gaji dan statusnya pun tidak jelas asn p3k atau kariawan biasa","0"
"turunin semua pajak pak,termasuk pajak kendaraan dan pajak pbb","0"
"trimakasih pak menkeu msh mau mikir sodara2 kami yg kena phk","0"
"mantap memang idol","0"
"naikin cukai roko bukan mengurangi peroko,justru malah beralih ke roko ilegal,dan roko bercukai produksi turun malah karyawan phk yang akhirnya malah nambah pengangguran perokoko tetap karena beralih ke roko ilegal","0"
"turunkan harga surya","0"
"keren pak pur ini","0"
"ngeri cara berpikir bapak teknokrat ini. mudah mudahan amanah.","0"
"mantap emang pa purbaya ini","0"
"tetap sehat pak semoga pa menteri tidak dapat ancaman laten","0"
"kebijakan, dampak...solusi. sangat bijaksana","0"
"moga pak purbaya sehat sllu","0"
"yang janjikan 19jt lowongan kerja gimana pak? kok malah banyak pemecatan buruh. kok malah banyak pengangguran,","1"
"top markotop pak pur","0"
"kebijakan pajak tinggi dan cukai tinggi mengakibatkan...berhenti produksi...berhenti produksi akhirnya ribuan karyawan phk.....pajak tinggi, cukai tinggi menciptakan ribuan pengangguran baru. makanya ayok...yg realistis saja supaya tidak ada phk...supaya tidak ada pengangguran baru,,, supaya rakyat bisa makan. nol kan pajak dan bea cukai nya.","0"
"menteri terbaik si","0"
"yang rakyat harapkan bukan membahas rokok pak menteri bahas sembako sandang papan pangan biar jangan terlalu mahal.","0"
"dibalik pengerdilan industri daun tembakau, daun ganja mengambil alih posisinya, mulai menjangkau pelosok2 pedesaan.. mohon perhatian nya","0"
"mantap pur!!!!","0"
"yg ngurus mbg kelamaan realisasi ke daerah2, penyerapan anggaran nya lambat..","0"
"turunkan cukai rokok pak maka semakin banyak rakyat yang jumlahnya jutaan akan bahagia","0"
"hebat ini","0"
"keren,, hapus tax amnesti. klu org kecil pajaknya gak seberapa. tapi klu org kaya, dengan perusahaan dan aset yg banyak, apa rela klu mereka gak bayar pajak.","0"
"bapak ini menkeu, ignasius jonan mentri perindustrian beres indonesia ini dengan mereka berdua aja..","0"
