"cleaned_comment","likes_count"
"semua yg diomongkan dan direncanakan pak menteri ini bukan hal baru. menteri² terkait sebelumnya juga sudah melihat dan menyadari itu, dan juga sudah mencoba menyelesaikannya. tapi ""terpental"" ada tembok resistensi besar yang maha tebal yg, selama ini tidak bisa didobrak, bernama korupsi, kolusi, nepotisme? kita lihat aja, sot kata beliau, 3 bulan ke depan okt, nov. des . purbaya seorang prndekar sakti bukan yang mampu melibas semua itu. atau, dia hanya ""katak"" dalam tempurung?","0"
"keren pak","0"
"tutup industri rokok gpp tp mitigasikan karyawan korban phk pabrik rokok. krn industri rokok tidak termasuk narkoba berarti mereka tenaga kerja legal yg ditarik pajak pph dan lain sebagainya. bukan industri yg memang dari awal tergolong narkoba.","0"
"persentase cukai rokok itu hitungannya bagaimana.. seperti ini masa 57 ? gudang garam surya 16 harga rp. 38.000, itu di potong cukai rp. 22.800, pabrik dapat rp. 15.200, belum potong biaya produksi dan lain2.","1"
"kalau hitungan orang normal seperti ini namanya 160 harga pokok produk. tapi kenapa bisa cara hitungnya harga total 38000 x 60 ? padahal harga produknya 15.200, bukan 38.000. apa ini berarti harganya sudah ditentukan dulu?","0"
"itu semua .. ujung2nya rakyat jelata juga yg bayar .. konglomeratnya mah biasa2 aja .. tetep kaya raya .. mungkin juga tambah kaya lagi","0"
"semoga bagus yg ini drpda sebelumnya","0"
"sy yakin ekonomi lebih bergairah dr tangan doi","0"
"keren pak mentri","0"
"mantab pak","0"
"betul itu masa lebih tinggi pajakya dari pada harganya","0"
"makanan bergizi berikan saja kepada kantin2 sekolah yg kelola spy ukm berjalan dan pengelolaan dipantau akademi gizi spy lebih mudah dan efisien jangan dikelola oleh pengusaha besar hasilnya tdk baik makanan kurang terkontrol dan menyedian jumlah besar","0"
"kok kaget sih, harusnya udah tau lah, emang nya harus jadi ketua mentri keuangan dulu baru cari tau? diberitakan udah banyak kabarnya, jangan kan pajak rokok, semua usaha pajaknya diluar nalar, tapi hutang negara gak juga berkurang","0"
"bahahaha... pusing pusing kalian pegawai malas, ga bisa nunggu lagi sampai akhir tahun baru ngabisin anggaran. kerja kerja kerja, ga bisa kerja kalian disikat. good job pak purbaya","0"
"mantapp..","0"
"dari dulu walaupun cukai pajak rokok kecilpun banyak jg yg gulung tikar, skg naikpun jg banyak gulung tikar, yg aneh apa? berikan isentif, bantuan jg utk karyawan dan perokoknya itu baru penyelesainnya mis, karyawan rokok dan perokok di subsidi dibidang kesehatan dan makanan sehat gratis jika berobat","0"
"pak pean kejar ada yg nerima suwap beres kok lolos lagi","1"
"keren...","0"
"nyimak2 berjalan nya waktu,.. pelan2 sedikit terkuak ya biang kerok perekenomian indonesia maju mundur,.. karena apa dan siapa,... mungkin ada perintah siapa,..","0"
"turunkan aja cukai nya , yang ngeroko tetap merokok pak. industri pada tutup nti kalau pajak tingggi.","0"
"lindungi juga penulis dan penerbit buku dari buku² bajakan yg dijual bebas dimarketplace","0"
"mantap ,jng di peduli yg bilang koboy penting pro rakyat,maju terus","0"
"kalau bisah trif rokok di pasaran di btsi harga tertinggi di nilai 20rb di renda 15rb.","0"
"jadi ingat bu puji ex. menteri kelautan","0"
"bagus ni mentri...","0"
"mana nih mahasiswa ui yg tiba tiba demo pak purba?? aneh giliran dpr bikin statement parah malah pada diem..","0"
"semoga selalu sehat dan berhasil pak","0"
"baru ada yang ngeh setelah sekian tahun bea cukai naik... maka nya pt gudang garam tutup buku , jual rokok 30rb masuk kantong cuma 12rb , yang gk ngapa""in dpt jatah gede contoh","0"
"bea cukai diturunkan terus jangan dikorupsi ini akan menghilangkan rokok ilegal karena meteka mampu bayar dan dan rakyat mampu beli apalagi bagi petani kecil","0"
"akibat pajak rokok tinggi jdi masyarakat lindungi rokok tanpa cukai rokok","0"
"diliat , diawasi , dikawal sampe kebijakn p.purba adil amanah krn allah swt aamiin.","0"
"semakin pajak rokok dinaikan, semakin mahal harga rokok dan semakin berkurang uang dapur ibu2nya, karena dialokasikan utk beli rokok.","0"
"kurangi harga rokok.. dengan bgtu bisa mengurangi pengeluaran bapak bapak !!!","0"
"keren lu pak","0"
"lindungi org baik ni.","0"
"betah dengerin pak purbaya dan pak dedi mulyadi tuh .","0"
"coba seharusnya dari dulu dapat pemerintahan yang begitu the next bahlil","0"
"20tahun sri membikin tambah buruk ekonomi menengah ke bawah indonesia..","0"
"mantap ini bapak....","0"
"gua lagi bayangin berapa puluh trillyun kekayaan srimulyani saat ini...","0"
"soalnya rokok lokal banyak pak djati dll saya suka harga bermasyarakat","0"
"gw suka mentri ini","0"
"tidak membuat harganya turun.","0"
"mentalaaa pak mentri, bismillah","0"
"mudah mudahan pak purbaya sehat selalu...bnyak kebijakan kebijakan sebelumnya yg tidak mendukung rkyat musti dirubah","0"
"keren nih pola pikirnya pak purba.","0"
"masak belom pernah dengar pak","1"
"jika menteri ini bisa menurunkan harga rokok sekelas contoh marlboro merah menjadi rp.20rb sampoerna mild menjadi rp.15rb maka rakyat indonesia 40 akan makmur, sebab, ekonomi keluarga baik buruknya tergantung uang saku laki2 perokok","0"
"masuk akal banget logika pemikirannya, beda kaya sales imf","0"
"mantap nii pak purbaya","0"
"bapak metri yang","0"
"pajak rendah negara nya hutang entah kemana uang nya. pajak tinggi negara berhutang entah kemana hasil pajak nya. padahal rakyat bayar pajak itu membantu negara agar tidak berhutang dan ada imbal balik nya kpd rakyat bukan untuk gaji,fasilaitas dan tunjangan kalian saja !!!!! masalah nya di politik rakus dan penegakan hukum nya amburadul.","0"
"mantap pak purbaya","0"
"nah ini neh menteri nyentrik, bukan cuma naikin cukai selangit tapi mematikan usaha orang, ribuan terdampak pengangguran, kejahatan akhirnya banyak. harus dipikir sampe dampak dan solusinya","0"
"ini yg tunggu..","0"
"keren pak....","0"
"orang kaya tiru ini ya, punya uang jangan disimpan di bank tapi untuk dibuat usaha yang bermanfaat luas","0"
"yang perokok harus di edukasi bahaya merokok bukan bunuh usahanya, pak mentri berpikirnya sampai ke petani rokok, pengusaha, pekerja dllnya, pak menkeu dan kdm kalau berbicara seperti seorang ayah","0"
"jangankan cukai rokok, tabungan bpjs ketenagakerjaan saat pensiun aja kalian pajakin yg jelas2 tabungan bekal orang pensiun.","0"
"pemikiran jangka panjang top wan","0"
"ini yg bner mikirin rakyat.. bukan asal pajak pajak dan pajak.. mikirin dampaknya juga","0"
"ternyata industri kita di tekan oleh luar. mereka tdak suka kita maju bersaing international","0"
"keren nih menteri","0"
"ratu pajak kebanyakan teori bikin susah... pak purbaya action lugas untuk selamatan anggaran yg berdaya guna.. kita tunggu impact nya kalau melenceng kita ingatkan","0"
"ya pak sekarang susah cari kerja karena lapangan kerja semangkin sedikit","0"
"hahaha pak mentri ini bicara apa adanya dan kocak, cm hati2 banyak yg tdk suka","0"
"kalau ke jawa timur jng ke pabrik besar p.menteri datang ke madura p.menteri biar bapak ngerti keadaan pabrik di madura p.menteri...","0"
"andai bahlil mau mencontoh pak menkeu kalau mau bikin kebijakan","0"
"i don't want to be fooled at the first impression... as long as your policies can bring a changes to thins country to going better, why not... we are all citizen will support your policies. just prove it!!!","0"
"sehat sehat pak","0"
"mitigasinya apa? ngga ada sekelas negara bikin kebijakan yg menyangkut hajat banyak orang pembahasanya sedangkal itu","0"
"pak purbaya....itu banyak umkm yang dikenakan ketetapan sangsi pajak yang tinggi diluar nalar pak....mohon ditinjau pak....karena oknum pejabat pajak yang main memeras klo ga berhasil mereka pake cara nilai ketetapan yang luar biasa nilainya.....","0"
"seneng liat pejabat yang bener2 ngerti sama apa yg mereka kerjain keliatan beliau cinta sama pekerjaannya jadi bkin optimis","0"
"melindungi market rokok dr luar naikan cukai nya,dalam negri turunkan","0"
"bapa ini keren sih santai berbobot","0"
"kerenn","0"
"hebatttt","0"
"purapura kaget","0"
"maaf sebenarnya tidak suka rokok ilegal tetapi harga rokok legal terlalu mahal.","0"
"takut banget menteri yg punya keberpihakan sama rakyat disingkirkan oleh orang2 jahat.sehat selalu pak purbaya.","0"
"mantappppp","0"
"entah knp sll jdi pham klu pak purbaya jelasin sesuatu","0"
"salah satu perusahaan terbesar pt. gudang garam merah phk karyawan pak... tolong selidik dengan tuntas","0"
"lanjutkan pak moga sehat serta amanah","0"
"baru kali ini aku salut sama mentrinya wowo satu ini yg keliatan","0"
"kebijakan pak mulyo dulu emang mindblowing","0"
"solusi saya pak, gak usah dengarin dewan perwakilan rakyat itu dia mau halang program pak menteri, termasuk rapat komisi sebelas kemarin. itu tampak muka dpr takut tidak kebagian uang yang akan di bank kan","0"
"harusnya tiap kementrian harus ada live streaming ketika rapat atau rumusan alasan mengeluarkan kebijakan biar semua faham maksudnya dan biar diluar tidak dipelintir jadi fitnah.","0"
"mantap bos ku","0"
"turunkan cukai rokok....","0"
"sdh mendekati firaun, sy sendiri merasakan, saya minjam bank, uang belum dipakai , angsuran sdh dipotong 2 bulan angsuran,","0"
"good job.. bosss","0"
"tul gara gara cukai roko naik roko ilegal jadi laku keras... karyawan pabrik roko bnyak di phk... pdhal pejabat di gajih dari pajak roko","0"
"kami para pecinta tingwe dgn alat linting tetap ngebul spt knalpot rk king. modal 200rb bisa merokok premium sepuasnya untuk stok 1.5 bulan","0"
"kalo sukses bawa indonesia keluar krisis.. bisa maju nih kita","0"
"gara2 cukai rokok tinggi.hrga rokoknya terus di naikin.jdnya rokok ilegal merajalela dan akhirnya daya beli rokok yg mudah laris macam merek sampoerna dan djarum berkurang peminat,krn harganya 30k ke atas.dan pabrik2 dr produk tsb gk sanggup menutupi biaya operasional yg semakin tinggi.sdgkn daya serap rendah.padahal jika semuanya stabil ribuan lapangan kerja selalu terbuka di pabrik2 tsb...!!","0"
"rakyat suka pejabat begini tapi dpr gak suka pejabat begini....","0"
"tetap kawal mr koboy. indonesia tidak suka dengan pejabat yg memihak ke rakyat","0"
"mantap menkeu 1 ini","0"
"baru tau alesan rokok knp mahal gokil nih mentri obrolannya lebih real dari pada dengerin rapat dpr","0"
"segera action","0"
"ganti abs jadi asal rakyat senang. ars","0"
"di kota saya ada gg pak ,, sekarang mulai ada phk ,, ksian kita cri lap kerj susah ,, bnyak yg nganggur","0"
"saya perokok.lebih mending turunkan harga rokok.karena banyak rokok dengan kualitas kurang tetap saya rokok.dan mungkin banyak yang lainya juga sesama perokok.","0"
"keren","0"
"cocok","0"
"justru semakin cukai naik banyak roko yang beredar rokok ilegal yang kualitasnya belum tentu dengan roko2 yg sudah ada","0"
"kalo diturunkan lebih baik cukai rokoknya, karena daya beli masyarakat juga dihitung,","0"
"gokil juga ni menteri","0"
"kok waras ya bapak ini... coba 25 orang saja pejabat ini begini, wahh mingkin kita bisa maju.","0"
"keren menkeu ini, sehat2 ya pak","0"
"enak dengar penjelasan pak purbaya,,beda jauh ama srimulyono....bahasanya bikin rakyat ga paham...wkwkkw","0"
"tolong pak, pajak pbb dan pkb juga di review lagi. kami sangat tercekik.","0"
"sistem cortexnya sering down dan sering error pak, beberapa perusahaan banyak komplain gk bisa input e faktur pajak ke sistem cortex. bahkan errornya bisa semingguan tidak bisa digunakan.","0"
"sy setuju cukai rokok mahal... biar pengguna rokok berkurang...tapi kesel aja gak ada solusi buat phk org2 yg kerja di pabrik.... kaya anak sd lagi kerja kelompok, bikin solusi tugas tapi gak mikirin dampaknya...","0"
"industri rokok tidak akan berkurang, tutup pabrik besar akan tumbuh pabrik2 rokok rumahan yg tdk pakai cukai .","0"
"gokil","0"
"masuk akal ni bagus menkeu yg bijaksana","0"
"ekspor rokok, cukai n pajaknya dikurangi biar ekspor rokok banyak. tenaga kerja terserap lebih banyak, pendapatan juga nambah","0"
"diluar negri rokok mahal masuk akal karna sedikit yang menjadi petani tembakau, di indo banyak petani tembakau tapi rokok mahal ngak masuk akal,mana ada yg mau beli rokok 4x harga beras, sesakau apapun perokok milih berhenti milih rokok murah.","0"
"cukai rokok ditinggikan juga ada alasannya. saya setuju cukai rokok tinggi.","0"
"keren pak memtri euy","0"
"bener tu kata pak menteri..selama ngga punya program buat bikin lowongan kerja jangan bikin kebijakan yang membikin industri pada tutup","0"
"jaman prabowo baru mentri ini terbaik","0"
"ini baru mentri punya hati ngk kaya sri ngk pernah turun liat situasi masyarakat kerjanya cuma naikin pajak pungut pajak kelamaan menjabat indonesia ancur..seemoga pak ditangan pak purnama indonesia makin baik","0"
"cukai rokok ,,,mencekik pengusaha ,,malah pemasukan tinggi ,,,pajak dinaikan lg, kemana semuanya uang2 tsb ??","1"
"mantab ini menkeu","0"
"pengen tahu kebijakan menkeu sebelumnya banyak hutang luar negeri. bagaimana solusi mengatasi hutang2 ini","0"
"pajak kendaraan dan denda tilang jangan lupa di pertanyakan pak, khusus yg penghasilan bukan pajak tolong di cek.","0"
"zaman sebelumnya terlalu banyak ikut campur dan di atur oleh cia, negara rusak tapi di framing seakan baik baik padahal aslinya di bawah rakyat sedang tidak baik baik saja, ekonomi menengah turun akibat ekonomi yang hanya 4.7 persen saja daya beli menurun","0"
"aturannya ajah gak sih yang di perketat untuk para peroko.. marketnya kembangin klo perlu bisa nembus masrket internasional","0"
"salam waras pak mentri,,,,,,","0"
"pertama agak ragu ama ni mentri, tapi kok jadi keren gini","0"
"orang males pak beli rokok resmi karna terlalu mahal,gak bisa beli apa apa lagi kita kalo beli rokok resmi","0"
"masuk akal pak menteri,ayo semangat kerja","0"
"kalo soal rokok emang susah sih misal rokok makin mahal dan orang orang pada stop merokok ujung ujung nya rugi juga pabrik kalo pabrik rugi dan tutup ujung ujung nya banyak yg phk dan pengangguran","0"
"positif sm pak purbaya","0"
"ada alasan pajak roko naik, sebanrnya untuk mengurangi perokok tpi kurang tepat karena ada rokok ilegal yg masuk..","0"
"pov sri mulyani ""ya maaf","1"
"mentri klo pinter bgitu.brani tatap muka dan terbuka soal iden dan cara kerjanya.....tp semua itu tergantung siapa org kuat di atasn nya..gak semua kebeneran bs di aplikasikan ...","0"
"mau hrga brpapun rokok ga akan buat orang berhenti merokok pak... klo mau memberantas rokok ilegal, tolong cukai rokok di pertimbangkan lagi...","0"
"semoga mentri baru ini ada perubahan","0"
"turunkan sampoerna mild jadi 20rb lagi pak","0"
"kemaren mana nih yg nentang beliau panas ga yah??","0"
"belum terealisasikan pak dana yg dari perbankan kur aja banyak yg d persulit , kasian mereka yg pengen punya modal usaha.","0"
"mentri srimulat yang dulu suka banget malak kin rakyat dgn pajak dan cukai yang mencekik rakyat bawah.","0"
"nah,bener ini pak. turunin cukai rokok,biar harga rokok turun. masyarakat indonesia banyak yang perokok. lihat datanya,dengan naiknya harga rokok,perokok bukannya berkurang,tapi mayoritas perokok menjadi lebih susah. faktanya,setidaknya di daerah saya,bapak"" mayoritas perokok,padahal mayoritas mereka petani. silahkan lihat faktanya dilapangan. dan benar kata pak mentri,rokok ilegal semakin menjamur. lebih baik kembangkan perindustrian dalam negri","0"
"salut si kalo ada orang yang bisa nurunin harga roko tapi ga akan terjadi kayak nya","0"
"mantap pak menkeu sikat brantas","0"
"gimana dgn pbb pak yg naik 100 1000 ? melebihi firaun dunk","0"
"kenapa baru sekarang bapak jadi mentri keuangan. knp nda dari dulu sri mulyani itu diganti. sri mulyani ga mikirin kesulitan rakyat","0"
"biasa aja, dia sedang memamerkan unsur pembeda dgn sri mulyani. paling juga sementara, setelah itu mingkem juga saat kenyataan ekonomi tidak seperti dan semudah yg diomongkan","0"
"wow saya iku terkejut","1"
"jgn lupa jg, dngan naiknya harga rokok, makin tdk laku rokok mahal, makin brmunculan rokok2 baru yg murah namun mngkin jauh lebih meragukan kualitasnya. walaupun berasal dr merk rokok trkenal. rokok sj pd dasarnya tdk sehat, aplg klo masyarakat beralih k rokok yg jauh lbh murah dan dampakny jauh lbih buruk untuk kesehatan. bs diam2 jd pnyebab naik nya angka kmatian.","0"
"nih bagus sih, cukai di tinggiin itu bukan solusi, itu cuma nambah uang kantong buat oknum oknum tertentu, orang kalau dah candu rokok mahal pun pasti di beli, kalau emang mau ngurangi perokok ya jngan cukai nya di tinggiin , cari solusi lain","0"
"seandainya semua mentri seperti ini","0"
"mantap pak menkeu.","0"
"turunkan cukai rokok..biar agak murah lagi","0"
"orang lapangan pemerhati pasar pemerhati efek kebijakan keuangan","0"
"bagus pak mentri purbaya turunkan cukai rokok.supaya dpt menyerap tenaga kerja.bisa beli rokok terjangkau","0"
"mentri yang menguasai masalah profesional akamedik..jangan mentri yang berasal dari partai politik...atau relawan ..pada gk bener kerjanya bikin gaduh..","0"
"di negeri ini banyak orang pintar dan berani tapi selma ini tidak pernh di kasih kesempatan","0"
"evaluasi, koreksi dan segera eksekusi. mungkin tidak terlalu perlu terlalu banyak narasi.","0"
"gini dong dari dulu sumber pendapatan ga harus jadi lintah buat rakyat sendiri,, kita punya kekayaan alam klo dikelola dgn baik bisa sebenernya,,","0"
"dari harga rokok surya 16.500 stelah beberapa tahun sekarang udah di harga 27.000","0"
"sebenarnya mudahkok untuk meminimkan rokok ilegal !! tentunya cukai rokok harus diturunkan kalau rokok yg legal harganya murah tentu masyarakat ga akan beli yg ilegal karena rokok yg legal aroma dan rasanya lebih enak dari pada yg ilegal disisi lain petani tembakau juga ada peningkatan dari segi penghasilan","0"
"ayo pa turunkan cukai negara malas cari uang selain pajak..kalau rakyat di gaji.. dari pajak ga apa cukai naik yg ngnggur yg kerja di gaji..ini engga kan cukai cuman dikumpul di bank bi aja","0"
"hapus blacklist bank ..agar bisa dapat kur lagi pak","0"
"style bahasa . apa ada nya. ga pake teks. real mnguasai ""keadaan"". good job","0"
"bumn itu jadi mata pencaharian para koruptor dua priode kemarin, orang orang bersih di bumn di lengserkan semua, dan posisi pejabat perusahaan diperjual belikan hasilnya pasti pejabat perusahaannya mo balik modal lah.. dampaknya kualitas produksi bumn menurun dan feedback ke negara dari bumn menjadi melemah, cara sembunyikan perketat pajak buat perusahaan swasta karena memang pajak perusahaan swasta juga gak pernah rapih pengusaha ilegal sudah ada dan banyak dari dulu, karena pemimpin pusing mana ngatasi tekanan dari barat juga bikin pusing alhasil pemimpin mengambil langkah suntik dana dari asing tapi gerbong lain, jadi dua priode kemarin bisa dibilang mengatasi masalah dengan masalah lain . jadi langkah awal buat perbaiki negara ini adalah atur ulang besaran angka di pajak, sesuaikan antara keperluan negara dan kemampuan rakyat, tidak lepas rakyat tetap harus wajib banget bayar pajak... jika ini berjalan baru menata bisniss buat negara ini berhasil baru bisa pajak diatur keangka minimal..","0"
"semoga saja harga rokok makin murah kaya dlu... tanpa rokok hidup ini sangat galau","0"
"turunkan cukai rokok 45 semua pabrik rokok se indonesia pindah ke negara lain yang tidak terlalu deras pajak rokok","0"
"pinter banget ini orang","0"
"nah common sense masuk nih, bos rokok pasti setuju, keuntungan rokok nikmat untuk yang punya pabrik rokok legal, bad news buat yang ilegal","0"
"turunkan cukai","0"
"g mau muji2 dlu ah...liat dlu hasil kerjanya,,semoga amanah smpai akhir","0"
"turunkan tarif cukai rokok.. turunkan harga rokok.","0"
"pak saya merokok karna kakak saya 3 kerja dirokok semua agar industri gak mati kakak saya bisa kerja. kalau bapak bisa ubah karyawan rokok ke industri lain saya berhenti merokok","0"
"prabowo pintar menyelidiki kerja orang jowo dipakai dulu dan diselidiki pas waktunya tidak bagus ganti orang yang bijak kaya pak purbaya dan ahy","0"
"bukan mengecilkan pak,tapi memperbesar industri rokok non cukai .","0"
"janga berpikir bisa mengurangi jumlah perokok hanya dengan menaikkan cukai","0"
"saya optimis dgn menkeu kita yg baru,,","0"
"ini baru masuk akal...","0"
"mantab","0"
"saham rokok naik 1.7 makasi menku","1"
"emg kebnyakan piraun pak","1"
"ayoo dukung menkeu dong, jangan jd pemalas, uang banyak noh pinjem tolong dilembalikan ya guyssd","0"
"selama ini bapak tinggal di gua ya, ga pernah bersosial. kemana saja selama ini bapak???","0"
"alamat turun gak harga garpit.. cape rokok ganti2 trus tiep minggu","0"
"betul kl cukai tinggi harga mahal perusahaan bangrut","0"
"ayo pak cukai rokok turunin lagi. buat kyk dulu biar gk ngrokok ilegal lagi. surya sampurna mentol 25k lagi. rokok mahal gk mampu beli yg cukai pak","0"
"ya memang pekerjaan pejabat sebelum sebelumnya menciptakan pengangguran sebanyak banyaknya to pak..","0"
"sayang sekali sri mulyani gak di audit dulu sblm pensiun","0"
"tujuan nya cukai mahal supaya perokok berkurang, dan industri rokok rumahan makin laris,","0"
"mantap pa menkeu..","0"
"ngalor gak ngalor ngidul ra ngidul","0"
"klo hrga tinggi g kn lku. bngkrut bisa. masyarakat bli yg murah meriah.","0"
"banyak rokok yg tidak pakai cukai saat ini beredar pak... krna mahal nya harga rokok yg pakai cukai sehingga yg dibeli rokok palsu tanpa cukai karena murah","0"
"cukai rokok jgn diturunin lah pak pajak kendaraan bermotor tuh yg diturunin gila harga motor di atas 300cc di malaysia thailand jauh lebih murah pak","0"
"penjelsan kyk lagi ngasih kuliah, jelas, terukur dan menguasai ilmunya. ini jelas berbeda dgn sebagian besar mentri saat ini yg kalo bicara isinya asbun dn angan2 semua sesuai dgn kebijakan mreka ngaco dn selalu menimbulkn kegaduhan!","0"
"ya memang sri mulyono fir'aun made in indonesia","0"
"wajib periksa bea cukai, gudang garam bangkrut karena mafia cukai .","0"
"turunkan harga sampoerna","0"
"gua demen nih dengernya","0"
"dampak pergantian menkeu ini nampaknya akan besar","0"
"pak, menkeu...jgn selalu menanggapi masalah dengan kata...kaget....yg dulu2 itu kan kalimat saktinya","0"
"kalo sampoerna 20 rb. wah bakal pindah semua ke sampoerna","0"
"sepakat murahin dong. percuma cukai di naekin juga orang orang masih ngeroko. paling nurunin ke roko ke yg murah. dah gitu malah bermunculan roko2 non cukai.","0"
"hmm. saya iseng menghitung multiplayer effect gdp negara kita bisa lho diatas 22 . perputaran uang negara kita bisa mencapai diatas 50.000 triliun thn. dengan asumsi jika saat ini cukai rokok 57 lalu seandainya negara memangkas cukai rokok 12 saja. maka yang terjadi pertumbuhan rakyat kelas menengah bisa mencapai diatas 80 . dan effect nya daya beli meningkat pesat. sy curiga dr dulu motifnya asing who emang sengaja bunuh market tembakau kita. karena mereka tau sebenernya kita itu plant market. mereka propaganda bunuh industri market kita. betapa banyaknya mikro makro umkm, industri, hingga pegawai rokok itu rusak akibat propaganda. sehingga daya beli rakyat turun dan warung bangkrut karena modal perbungkus rokok terus naik dan terus merugi","0"
"saya kena phk pak gara2 efisiensi perusahaan saat ini","0"
"pak menteri selamatkan karyawan gudang garam","0"
"turunkan harga cukai ! berharap rokok garpit jadi 18rb","0"
"legend","0"
"ini baru pejabat, cari solusi ngga minta ke rakyat","0"
"ayo pak menteri saya sangat mendukung semoga bapak kerja sat set jangan kebanyakan teori tunjukan sekilo kerja bapak harus lebih hebat dari sri mulyani yg katanya sudah sampe amerika","0"
"logat na sunda pisan euy","0"
"harga harga diturunkan pakkk","0"
"nahh ini yg gue tunggu","0"
"cukai palsu pak yg di berantas, rokok2 murah yg beredar ini semua pakai cukai resmi, tp tidak sesuai dengan isi. contohnya kemasan isi 20 batang, cukainya cuma 10 batang.","0"
"ok pak pur..... gajimu naik gak apa apa","0"
"sepertinya menteri yang baru, yang kerja bapak doang. yang lain pada diem diem aja","0"
"turunkan harga roko","0"
"negara ini apa sihh yg gk mahal. bea msk ke negara ini aja tinggi. pdhl hrg bli brng dr luar mah gk sbrapa.","0"
"audit dong kekayaan sri mulyani","0"
"pajak turunin juga pak jangan 11 pak , terimakasih","0"
"mengenai gaji buruh ""umr"" tapi kena pph 21 gimn pak","0"
"kemane aja looo....","0"
"gara gara kebijakan yang salah, buruh menjadi korban. semangat pak menkeu yang baru!","0"
"tinggi amat, fir'aun luh","0"
"pola pikirnya nalar banget daripada mentri sebelumnya","0"
"padahal gula lah yg membuat angka diabetes naik","0"
"kalo ada perbandingan kebijakan kyk gini.. baru kita melek apa itu yg namanya kebijakan untuk kebaikan rakyat dan negara. seperti apa yg kebijakan yg dikerjakan mentri sebelumnya!","0"
"klu bu sri udh ada drama nangis ni ngomong nya","0"
"itulah kurangannya pembuat kebijakan terdahulu, gak ada yg mikirin dampaknya tanpa ada solusi dan mitigasi untuk rakyat menengah ke bawah. yg ada makin byk pengangguran angka kemiskinan meningkat.","0"
"kebocoran kebocoran yg selalu di gaungkan pak prabowo sepertinya mulai terungkap yg dulu berati banyak yg fira'un yg pak menkeu","0"
"jaga warisan rokok jangan dikambing hitamkan","0"
"sudah naik sahamnya......","0"
"ekonomi bisa bangkit kalau cukai cukup 10 persen aja","0"
"cukai rokok tinggi...harga rokok tinggi...rakyat juga yang di bebani ....","0"
"purbaya effect","0"
"sri mulyani tidak sampai berpikir nya","0"
"hidup nu pemberi tenaga kerja pemberi pajak, dari rokok","0"
"sukur jugak akhir nya ganti baju ya pak","0"
"bergaya kget...tak mgkin ga tau bro","0"
"cocok","0"
"saya sangat setuju harga rokok dinturunkan lagi.karena menurut saya negara rugi","0"
"dari semua mentri yang sudah dilantik diperiode prabowo, akhirnya cuman mentri ini yg tau mau kerja apa. yang lainnya cuman tau ngomong itupun sring blunder.","0"
"gokil pak menkeu","0"
"naikan gaji. umr 10 jt..dan karyawan 20..jt. apa tidak bisa...dari jaman ke jaman. gaji karyawan cuma 4 jt...sedangkan. bahan pokok naik terus..jiga semua di pajaki.dan pajak semakin naik...bisa beli apa gaji 4 jt....","0"
"turunkan harga rokok secepatnya","0"
"koboy nya indonesia... lanjutkan pak koboy....","0"
